{
  "schema_version": 1,
  "master_deck": "Presentations/Performance_Schulung_Chat_2026-07-23_2146_SQL_Server_Performance_Grundlagen.pptx",
  "master_sha256": "17c55c8f4e6a2ff06cd1e7d81118bdc5e50021d395f157aa65ed38351054d787",
  "profiles": {
    "BASIS": {
      "custom_show": "SQL Performance – Basis",
      "include_depth": [
        "BASIS"
      ],
      "include_roles": [
        "INTRO",
        "THEORY",
        "DEMO_INTRO",
        "DEMO_EXECUTION",
        "DEMO_RESULT",
        "LAB",
        "EXERCISE",
        "SOLUTION",
        "SUMMARY",
        "TRANSITION",
        "REFERENCE"
      ],
      "exclude_slide_keys": [],
      "rationale": "Gemeinsamer Kernpfad mit Diagnosemethode und sicheren Grundbegriffen."
    },
    "STANDARD": {
      "custom_show": "SQL Performance – Standard",
      "include_depth": [
        "BASIS",
        "STANDARD"
      ],
      "include_roles": [
        "INTRO",
        "THEORY",
        "DEMO_INTRO",
        "DEMO_EXECUTION",
        "DEMO_RESULT",
        "LAB",
        "EXERCISE",
        "SOLUTION",
        "SUMMARY",
        "TRANSITION",
        "REFERENCE"
      ],
      "exclude_slide_keys": [],
      "rationale": "Regulaere Schulung mit technischer Herleitung ueber den Kernpfad hinaus."
    },
    "VERTIEFUNG": {
      "custom_show": "SQL Performance – Vertiefung",
      "include_depth": [
        "BASIS",
        "STANDARD",
        "VERTIEFUNG"
      ],
      "include_roles": [
        "INTRO",
        "THEORY",
        "DEMO_INTRO",
        "DEMO_EXECUTION",
        "DEMO_RESULT",
        "LAB",
        "EXERCISE",
        "SOLUTION",
        "SUMMARY",
        "TRANSITION",
        "REFERENCE"
      ],
      "exclude_slide_keys": [],
      "rationale": "Vollstaendiger freigegebener Bestand einschliesslich Optimizer-Internals und IQP."
    }
  },
  "slides": {
    "SLD-M00-001": {
      "order": 1,
      "module": "M00",
      "depth": "BASIS",
      "roles": [
        "INTRO"
      ],
      "title": "Titel und fachlicher Rahmen des Grundlagenkurses",
      "claims": [
        "CLM-001"
      ],
      "sources": [],
      "learning_objectives": [
        "LO-M00-01"
      ],
      "demos": [],
      "requires": [],
      "paired_with": [],
      "links_to": [],
      "profile_overrides": [],
      "notes_required": true
    },
    "SLD-M00-002": {
      "order": 2,
      "module": "M00",
      "depth": "BASIS",
      "roles": [
        "THEORY"
      ],
      "title": "Erst beobachten und messen, dann gezielt verändern",
      "claims": [
        "CLM-002"
      ],
      "sources": [
        "SRC-028"
      ],
      "learning_objectives": [
        "LO-M00-02"
      ],
      "demos": [],
      "requires": [],
      "paired_with": [],
      "links_to": [],
      "profile_overrides": [],
      "notes_required": true
    },
    "SLD-M00-003": {
      "order": 3,
      "module": "M00",
      "depth": "BASIS",
      "roles": [
        "THEORY"
      ],
      "title": "Performance als Zusammenspiel von Latenz, Durchsatz, Ressourcen und Nebenläufigkeit bewerten",
      "claims": [
        "CLM-003"
      ],
      "sources": [
        "SRC-028"
      ],
      "learning_objectives": [
        "LO-M00-01"
      ],
      "demos": [],
      "requires": [],
      "paired_with": [],
      "links_to": [],
      "profile_overrides": [],
      "notes_required": true
    },
    "SLD-M00-004": {
      "order": 4,
      "module": "M00",
      "depth": "BASIS",
      "roles": [
        "THEORY"
      ],
      "title": "Diagnosezyklus: Symptom, Engpass, Plan, Änderung, Nachweis",
      "claims": [
        "CLM-004"
      ],
      "sources": [
        "SRC-027",
        "SRC-028"
      ],
      "learning_objectives": [
        "LO-M00-02"
      ],
      "demos": [],
      "requires": [],
      "paired_with": [],
      "links_to": [],
      "profile_overrides": [],
      "notes_required": true
    },
    "SLD-M00-005": {
      "order": 5,
      "module": "M00",
      "depth": "STANDARD",
      "roles": [
        "THEORY"
      ],
      "title": "Plan, DMVs, Query Store, Extended Events und OS-Metriken beantworten unterschiedliche Fragen",
      "claims": [
        "CLM-005"
      ],
      "sources": [
        "SRC-027",
        "SRC-028"
      ],
      "learning_objectives": [
        "LO-M00-03"
      ],
      "demos": [],
      "requires": [],
      "paired_with": [],
      "links_to": [],
      "profile_overrides": [],
      "notes_required": true
    },
    "SLD-M00-006": {
      "order": 6,
      "module": "M00",
      "depth": "STANDARD",
      "roles": [
        "THEORY"
      ],
      "title": "IQP-Funktionen hängen von Engine-Version, Kompatibilitätsstufe und teils Konfiguration ab",
      "claims": [
        "CLM-006"
      ],
      "sources": [
        "SRC-007",
        "SRC-025",
        "SRC-026"
      ],
      "learning_objectives": [
        "LO-M00-04"
      ],
      "demos": [],
      "requires": [],
      "paired_with": [],
      "links_to": [],
      "profile_overrides": [],
      "notes_required": true
    },
    "SLD-M01-001": {
      "order": 7,
      "module": "M01",
      "depth": "BASIS",
      "roles": [
        "INTRO"
      ],
      "title": "Modulnavigation zu Storage und I/O",
      "claims": [
        "CLM-007"
      ],
      "sources": [],
      "learning_objectives": [
        "LO-M01-01",
        "LO-M01-02",
        "LO-M01-03",
        "LO-M01-04",
        "LO-M01-05"
      ],
      "demos": [],
      "requires": [],
      "paired_with": [],
      "links_to": [],
      "profile_overrides": [],
      "notes_required": true
    },
    "SLD-M01-002": {
      "order": 8,
      "module": "M01",
      "depth": "BASIS",
      "roles": [
        "THEORY"
      ],
      "title": "Daten- und Logdateien haben unterschiedliche Rollen und I/O-Muster",
      "claims": [
        "CLM-008"
      ],
      "sources": [
        "SRC-003",
        "SRC-033"
      ],
      "learning_objectives": [
        "LO-M01-01"
      ],
      "demos": [
        "STL-005"
      ],
      "requires": [],
      "paired_with": [],
      "links_to": [],
      "profile_overrides": [],
      "notes_required": true
    },
    "SLD-M01-003": {
      "order": 9,
      "module": "M01",
      "depth": "STANDARD",
      "roles": [
        "THEORY"
      ],
      "title": "Filegroups sind Verwaltungs-/Platzierungseinheiten; Performance folgt nicht automatisch",
      "claims": [
        "CLM-009"
      ],
      "sources": [
        "SRC-003"
      ],
      "learning_objectives": [
        "LO-M01-01"
      ],
      "demos": [],
      "requires": [],
      "paired_with": [],
      "links_to": [],
      "profile_overrides": [],
      "notes_required": true
    },
    "SLD-M01-004": {
      "order": 10,
      "module": "M01",
      "depth": "BASIS",
      "roles": [
        "THEORY"
      ],
      "title": "SQL Server organisiert Datenseiten in Extents; die Struktur erklärt Zugriffsmuster",
      "claims": [
        "CLM-010"
      ],
      "sources": [
        "SRC-002"
      ],
      "learning_objectives": [
        "LO-M01-02"
      ],
      "demos": [
        "STL-004"
      ],
      "requires": [],
      "paired_with": [],
      "links_to": [],
      "profile_overrides": [],
      "notes_required": true
    },
    "SLD-M01-005": {
      "order": 11,
      "module": "M01",
      "depth": "STANDARD",
      "roles": [
        "THEORY"
      ],
      "title": "Zeilen- und Seitenstruktur begrenzen nutzbaren Platz und beeinflussen Seitenzahl",
      "claims": [
        "CLM-011"
      ],
      "sources": [
        "SRC-002"
      ],
      "learning_objectives": [
        "LO-M01-02"
      ],
      "demos": [],
      "requires": [],
      "paired_with": [],
      "links_to": [],
      "profile_overrides": [],
      "notes_required": true
    },
    "SLD-M01-006": {
      "order": 12,
      "module": "M01",
      "depth": "STANDARD",
      "roles": [
        "THEORY"
      ],
      "title": "Breitere Zeilen senken Zeilen pro Seite und können logische Reads erhöhen",
      "claims": [
        "CLM-012"
      ],
      "sources": [
        "SRC-002"
      ],
      "learning_objectives": [
        "LO-M01-02"
      ],
      "demos": [
        "STL-001"
      ],
      "requires": [],
      "paired_with": [],
      "links_to": [],
      "profile_overrides": [],
      "notes_required": true
    },
    "SLD-M01-007": {
      "order": 13,
      "module": "M01",
      "depth": "VERTIEFUNG",
      "roles": [
        "THEORY"
      ],
      "title": "Allocation Units trennen In-row-, LOB- und Row-overflow-Speicher innerhalb von Partitionen",
      "claims": [
        "CLM-013"
      ],
      "sources": [
        "SRC-002",
        "SRC-019"
      ],
      "learning_objectives": [
        "LO-M01-03"
      ],
      "demos": [],
      "requires": [],
      "paired_with": [],
      "links_to": [],
      "profile_overrides": [],
      "notes_required": true
    },
    "SLD-M01-008": {
      "order": 14,
      "module": "M01",
      "depth": "BASIS",
      "roles": [
        "THEORY"
      ],
      "title": "Der Buffer Pool macht logische Reads zur zentralen Messgröße; physische Reads sind ein Teil davon",
      "claims": [
        "CLM-014"
      ],
      "sources": [
        "SRC-001"
      ],
      "learning_objectives": [
        "LO-M01-04"
      ],
      "demos": [
        "STL-006"
      ],
      "requires": [],
      "paired_with": [],
      "links_to": [],
      "profile_overrides": [],
      "notes_required": true
    },
    "SLD-M01-009": {
      "order": 15,
      "module": "M01",
      "depth": "BASIS",
      "roles": [
        "THEORY"
      ],
      "title": "Logical Reads und Physical Reads sind getrennt zu interpretieren; Cachezustand beeinflusst den Messlauf",
      "claims": [
        "CLM-015"
      ],
      "sources": [
        "SRC-001"
      ],
      "learning_objectives": [
        "LO-M01-04"
      ],
      "demos": [
        "STL-006"
      ],
      "requires": [],